<?xml version="1.0" encoding="UTF-8"?>

<response
xmlns:xsi="http://www.w3.org/2001/XMLSchema-instance"
xsi:noNamespaceSchemaLocation="../response.xsd">
    <name>–ò–Ω—Ñ–æ—Ä–º–∞—Ü–∏—è</name>
    <keyboard row_width=2>
        <key>
            <text>‚è∞ –†–∞—Å–ø–∏—Å–∞–Ω–∏–µ –∑–≤–æ–Ω–∫–æ–≤</text>
            <callback_data>‚è∞ –†–∞—Å–ø–∏—Å–∞–Ω–∏–µ –∑–≤–æ–Ω–∫–æ–≤</callback_data>
        </key>
        <key>
            <text>üéì –ö–æ—Ä–æ—Ç–∫–æ –æ–± —É—á–µ–±–µ</text>
            <callback_data>üéì –ö–æ—Ä–æ—Ç–∫–æ –æ–± —É—á–µ–±–µ</callback_data>
        </key>
    </keyboard>
</response>